Sentence,Language
"Wella sra9ni, w ketblhom Rabi ydokhlo lel 7bass.",Daridja
"Hanged, drawn and quartered",English
Elle a un accent charmant.,French
Piece of cake ...,English
J'adore voyager.,French
Quelle est ta région française préférée pour les vacances d'été ?,French
ni 9raya mli7a ni m3icha f residence mli7a ni blad mli7a,Daridja
Red in tooth and claw,English
W hadak li yab3at lien partout sada9ni mahich khadma ta3 rjal,Daridja
Il aime les toasts avec du beurre et le café à la crème.,French
Gérard mène tout le monde à travers le village.,French
Beat the living daylights out of someone,English
C'est magnifique.,French
C'est parfait.,French
Writing is on the wall - The,English
Notre journée de travail n'est pas tout à fait terminée. ,French
Khawti ki t7b tsjl f la BN lzam tkoun 3ndk résidence f Alger ??,Daridja
Elle revient du supermarché.,French
Nrmlment m wahran wala tmouchainte,Daridja
kechma njib l dar fi trigi ?,Daridja
Do you wanna go play some bolwing later on ?,English
"The ants are my friends, they're blowing in the wind",English
raki mechghoula douka ?,Daridja
Le maçon contruit la maison avec du ciment.,French
"C'est une journée ensoleillée, parfaite pour une séance photo.",French
Hadi chhal macheftekche,Daridja
"1 saut, 2 pas, 3 sauts, 2 pas.",French
Popular fallacies - The Nonsense Nine.,English
Place for everything and everything in its place - A,English
Tout le monde était en short et en T-shirt.,French
"Très bien, et toi ?",French
Countenance more in sorrow than in anger - A,English
"comme le sport, la lecture, les soins de la peau, le maquillage. ",French
The whole nine yards,English
voilà voilà sa7a 3idkoum la7bab !,Daridja
Five o'clock shadow,English
"If wishes were horses, beggars would ride",English
Upset the apple-cart,English
Chaque 8 bits de l'adresse représente un nombre décimal,French
rahou yel3ab film chbab,Daridja
kayen accident fi trig el mouradia,Daridja
"Le lendemain matin, Petit Poulet et ses amis ont disparu. ",French
Queer as a nine bob note,English
Ramdan li fat kont nakol ghir tmer o chorba o chlada,Daridja
À bientôt !,French
Fathom out,English
"De tels phénomènes sont naturellement étudiés en biologie, en démographie et en sociologie.",French
Tla9it b 3ammi moh ,Daridja
barak Allahou fik akhi,Daridja
marhba bikom,Daridja
Il a bien fait de remarquer cet erreur.,French
Left hand doesn't know what the right hand is doing.,English
The tail wagging the dog,English
Test your mettle - see show your mettle,English
Drag-and-drop.,English
Pourquoi ne pas essayer de faire du vélo le long de la côte française ?,French
Paint the town red,English
What's not to like?,English
w li tghid sah hadak lbahloul li ypzrtagi lien partout,Daridja
A dish fit for the gods,English
Don't count your chickens before they are hatched.,English
Wa9il f esi makanch had bnadam,Daridja
"So, sue me if you want.",English
The temperature is expected to reach 30 degrees Celsius today.,English
jwayeh blida ,Daridja
Comment peut-il être méchant comme ça ?,French
C'est important.,French
Khammemt bzaf 9bal mn7ot had l poste.,Daridja
Chorba jat bnina 3ssel,Daridja
"POSH - Port out, starboard home",English
"While you live, tell truth and shame the Devil!",English
ntajek rahom b dyarhom,Daridja
"Romeo, Romeo, wherefore art thou Romeo?",English
Wella mazal 7atan tekber,Daridja
Hey honey. I'm home.,English
Mataklouch l7am bzf,Daridja
W HATA WAHED MA RAYAH YEKHROJ INGENRIEUR ,Daridja
Quelle est ta région française préférée pour les sports d'hiver ?,French
w lkhedma li t3ebt eliha ,Daridja
Comment s'appelle ce musée ?,French
Greased lightning,English
mana lfo9 nrml ra7 yossalkom qr code in max 30 min.,Daridja
As-tu déjà goûté une baguette fraîche ?,French
Ask a silly question and you'll get a silly answer.,English
"Ro7t nebki, nebki bka b chah9a",Daridja
Drummed out of the army,English
Ring-fencing,English
Ya khoya ya khoya doubara double har double zit fi ramadan.,Daridja
Ch7al mn 7aja f deen 3and'ha tafssir ta3ha,Daridja
Une spécification opérationnelle,French
The birds and the bees,English
I have nothing to declare but my genius.,English
To big for your boots,English
W zit zitouna nakder ndirelha fel khodra ,Daridja
Bought the farm,English
Les éclats de rire sont le meilleur remède.,French
roh cha33el el conteur ,Daridja
ki tchof hadak tmaskhir kamal wash ha tgol,Daridja
Movers and shakers,English
"Ila kemelti m3a wahed kima hada, li darha fik qlil.",Daridja
Hurry up! We don't want to miss the bus.,English
Sir Walter Scott (phrases coined by),English
Four by two,English
Allons-y !,French
nas li rahom baghyin ye9raw golili bark wach rah 3ajebkom,Daridja
douk nzid chwia w nji,Daridja
Catbird seat - In the Binge drinking,English
makach wash dir,Daridja
nsitou beli lezem ta3abdou rabi sobhanu,Daridja
Go over like a lead balloon,English
chkon fiha mliha ESI wla MI ( mnish hab nhre9 rassi b 9raya),Daridja
C'est intéressant.,French
Economical with the truth,English
I'll go to the foot of our stairs,English
Mon ami français est très sympa.,French
Les éclats de rire des enfants résonnent dans la cour.,French
Faint-hearted,English
Pick 'n' mix,English
"The cyclist pedaled through scenic landscapes, enjoying the freedom of the open road.",English
Hadek insan hareb ,Daridja
"The piano melody filled the room, creating a serene atmosphere.",English
Is this a dagger which I see before me?,English
Rhyme nor reason,English
Puis il court dans la rue pour prévenir tous les autres.,French
The pip - Get/got/have,English
Laugh like a drain,English
Cut off your nose to spite your face,English
Barking up the wrong tree,English
Stand up guy,English
Big Apple - The,English
"Sur la rue principale, ils rencontrent Gérard le renard. ",French
Décrire le résultat des requêtes SQL suivantes.,French
"Massa'a El khir, nass l kol,  Shabi, ",Daridja
Zedti jahaltini ana,Daridja
Est-ce que tu parles français couramment ?,French
Les éclats de rire résonnent dans la pièce.,French
I need to buy two dozen eggs for the recipe.,English
b hadak él mard él khabith éd3oulou b chifa,Daridja
Rose by any other name would smell as sweet.,English
Il est essentiel de respecter les coutumes locales.,French
Les châteaux médiévaux français sont chargés d'histoire.,French
Pourquoi ne pas écouter de la musique française ce soir ?,French
kima jatni l'idée bach nbda jatni l'idée bach n7abess,Daridja
Beware the Ides of March,English
Les étoiles brillent dans le ciel nocturne.,French
Wouldn't touch with a barge-pole,English
Quel est votre numéro de téléphone ?,French
I haven't got a clue,English
Cry havoc and let slip the dogs of war,English
khlaso 3likom kamal blayas rohto ltd ta3 groupe ?,Daridja
Dites-moi tout en commentaires.,French
La mode française est élégante et intemporelle.,French
Il est agréable de passer du temps avec des amis.,French
Ya rabbi ntalla3 semstre,Daridja
"Separate the egg white from the egg yolk, then mix the egg yolk with sugar.",English
Pourquoi ne pas apprendre quelques expressions françaises ?,French
Wlidou roh te9ra 9raytek,Daridja
King James' Version of the Bible,English
ymeddoulek haja takhadmiha,Daridja
Preaching to the choir,English
"The garden bloomed with a kaleidoscope of colors, showcasing nature's beauty.",English
"Marley said: no, I shall not come to your art exhibition.",English
à chaque qu'elle pense à lui,French
Camera cannot lie - The,English
You can't just do that !,English
Est-ce qu'il y a des traditions et des plats spéciaux dans votre pays ? ,French
Quel est ton monument français préféré ?,French
Lala biensssssssuuuuur nti lghalta akhah watzidi tsaksi????????,Daridja
Flavor of the month,English
(It) fell off the back of a truck,English
"No way, Jose",English
On the button,English
L'hôpital se trouve à 200m d'ici.,French
"Oh no, I forgot to buy milk at the grocery store.",English
"J'ai presque oublié : j'achète beaucoup de vin et de champagne, car il fait très chaud et nous avons très soif.",French
"Ki ygolek raby madirch hadak chi,",Daridja
"The aroma of freshly baked bread wafted through the air, enticing passersby.",English
Et affectés à une salle qui n'en dispose pas.,French
"C'est une journée froide, idéale pour une soirée au coin du feu.",French
Shot in the arm,English
"Though this be madness, yet there is method in it.",English
C'est cool !,French
Nombre d'enseignements différents par salle.,French
1000 et une nuits.,French
All in all,English
Beat swords into ploughshares,English
had nhar ta3 ajr w howa yrabho fi. D3awi char,Daridja
Dieu a crée les hommes et les femmes.,French
Jack in the box,English
Hakka bech nzidou f les donnes,Daridja
"Rana nessenaw fik, matawelche w arwahx",Daridja
Bodice ripper,English
"Et si on ne fait pas tout ça un petit peu tous les jours, ",French
The face that launched a thousand ships.,English
Cookie cutter,English
The asteroid belt lies between Mars and Jupiter and is home to many rocky objects.,English
Kima kan 3ndk lwa9t bch tkhdm,Daridja
besa7 rani srx w nehdar mn 9albi,Daridja
lguite drahem 9dam lbab,Daridja
ki tshoufou un groupe fih bezzaf 7atou vos bavettes,Daridja
bdinahaa kif kif w ida 7abinaha tanja7 lazem nkamlouha kif kif,Daridja
9bel mtjo t9raw atrabaw!,Daridja
Qui trop embrasse mal étreint.,French
"Les paroles s'envolent, les écrits restent.",French
The Oort Cloud is a theoretical region of icy bodies at the outer edge of the solar system.,English
On n'est jamais mieux servi que par soi-même.,French
"La patience est une vertu, elle mène à de meilleurs résultats.",French
ga3 mkhalyin 9rayatnaa de coté w ga3 9a3din f shmisa,Daridja
tgoulou haya ygolk je m'en fou,Daridja
estahel da3em lazem yawsel,Daridja
L'habit ne fait pas le moine.,French
The Kuiper Belt is a region of the solar system beyond Neptune that contains many icy objects.,English
Chacun voit midi à sa porte.,French
Li y3rfha mn 9bel yoskt,Daridja
The study of cosmic microwave background radiation helps scientists understand the early universe's conditions.,English
li mayjish sba7,Daridja
"A light-year is the distance light travels in one year, roughly 5.88 trillion miles.",English
Mars is often called the "Red Planet" due to its rusty appearance caused by iron oxide.,English
"La vie est un voyage, profitez du trajet.",French
lazem 7na ndirou flitox electroni pr exmpl nkhayrou nhar wela zoudj f smana,Daridja
Chaque nuage a une doublure argentée.,French
mat9oulish mal7a9tsh bakri,Daridja
The Orion Nebula is a stellar nursery where new stars are born.,English
l9adiya machi t3 la3b rakom te9raw,Daridja
On apprend de ses erreurs.,French
"Mieux vaut prévenir que guérir, soyez proactif dans vos choix.",French
Il n'y a pas de fumée sans feu.,French
Qui sème le vent récolte la tempête.,French
The Great Red Spot is a massive storm on Jupiter that has been raging for centuries.,English
Exoplanets are planets that orbit stars outside our solar system.,English
Mieux vaut tard que jamais.,French
The Heliopause marks the boundary where the solar wind meets the interstellar medium.,English
Les petits ruisseaux font les grandes rivières.,French
The Hubble Space Telescope has provided breathtaking images of distant galaxies.,English
9bel ma njou3,Daridja
Mnb9awch n3awdo fnafs lhadra,Daridja
Chi li rah ydir fih hada l bnadem bezaaaf wellah,Daridja
"Chassez le naturel, il revient au galop.",French
ljma3a ay tatlem w trou7 tsigni marahish mdayra 7ssab,Daridja
khemou f hadou swale7 seyyiw tchoufoulna 7ouloul bch n7eyiw l7irak ,Daridja
w hedouk li ma yjiwch w yeb3tou s7abhem,Daridja
3la bali beli kayen li ra7 yed7ak ki ye9ra ,Daridja
On récolte ce que l'on sème.,French
ma tfechlounach b3d ma mchina fl grève,Daridja
kont nkhamem ndir 3lih poste,Daridja
makan lah tkhelouna njiw nkharjokom,Daridja
The Milky Way is a vast spiral galaxy that contains our solar system.,English
Madabina ga3 Nkounou 3arfin bihaa 9bel ma tasra,Daridja
khemou chwiya 9bel matreagiw,Daridja
nsemiwkom bl wahd,Daridja
La vérité sort de la bouche des enfants.,French
The International Space Station (ISS) serves as a microgravity and space environment research laboratory.,English
wash yatbadal w ida mli7a w houwa y3awad y9oul,Daridja
À quelque chose malheur est bon.,French
"Dark matter, though invisible, is believed to make up a significant portion of the universe's mass.",English
"L'union fait la force, ensemble on est plus fort.",French
rani manich non9os khls kima kount man 9bel,Daridja
"The Andromeda Galaxy is on a collision course with our Milky Way, but it won't happen for billions of years.",English
kol wa7ed y7el wch ye9der w nebdaw,Daridja
nas ykounou dispo mo3dam el we9t,Daridja
Il vaut mieux être seul que mal accompagné.,French
