Sentence,Language
The tailor carefully crafted a bespoke suit for his discerning client.,English
Ne'er cast a clout till May be out,English
machi 9adiyat fechlt wella haja 9ana3a cha5siya brk ,Daridja
Chalk and cheese,English
Endi smana mli khlas dit décision,Daridja
An Englishman's home is his castle,English
"Ce n'est pas obligatoire, on peut faire l'expérience sans s'inscrire?",French
Les éclairs zèbrent le ciel pendant l'orage.,French
Which witch is which?,English
OUI (Organizational Unique Identifier).,French
Trig wa9il ay maghloo9a,Daridja
Spend a penny,English
Pigs might fly in your dreams.,English
Miss is as good as a mile,English
Montezuma's Revenge,English
Les étoiles scintillent dans la nuit étoilée.,French
W 9balto w rakoum ta7fdo w tzidou t assistiw...,Daridja
Quelle est ta chanson préférée ?,French
Sticks and stones may break my bones,English
"Jack of all trades, master of none.",English
Paper tiger,English
Katy bar the door,English
"Peut être oui, et peut être non.",French
"O ye, of little faith",English
"?métro, boulot, dodo?, c'est une expression française qui veut dire que tous les jours, ",French
Les châteaux médiévaux français sont chargés d'histoire.,French
C'est difficile à croire.,French
tsemma makallah njibouha,Daridja
But here's the twist.,English
Je dois prévenir tout le monde ! crie Petit Poulet.,French
koun djaw mta9fin maydirouha  x),Daridja
"Et voilà, quelqu'un y avait laissé un message très intéressant. ",French
Bowled a maiden over,English
Brass tacks - get down to,English
Les éclairs illuminent le ciel pendant l'orage.,French
ya khawti li yechkhor yriye7 f darhoum svp,Daridja
"3ana9t yemma w baba, khti, khawti, ",Daridja
denya t'dour,Daridja
inchallah nharkom zin,Daridja
One-hit wonder,English
.nass wellate machi mrabya,Daridja
Lay it on with a trowel,English
J'aime les films français romantiques.,French
Darkest hour is just before the dawn.,English
Nti ghalta koun tzidi d9i9a m3a hayawan kima hada (hacha lhayawanat),Daridja
Third time lucky,English
All things must pass.,English
"Gérard est assis dans un café, en train d'écrire sur son laptop.?",French
Quelle est la capitale de la France ?,French
Stick in the mud,English
Let's Picture the 1960s.,English
C'est difficile.,French
Had el 9arar kont niziti fih chwiya,Daridja
All publicity is good publicity.,English
As dead as a dodo,English
"Bel 7ad f lil, lilet le 5,",Daridja
Take potluck,English
Les étoiles scintillent dans le ciel étoilé.,French
Haba nakhdem ma dar w andi pc w cnx kifeh ndir ??,Daridja
alch le corps dyali bloka ? ,Daridja
"Look at you, Bob !",English
With bells on,English
Exceedingly well read,English
en faisant des tâches et remplissant nos obligations professionnelles. ,French
Red letter day,English
Tables relationnelles utilisant un type utilisateur.,French
Do you prefer coffee or tea in the morning?,English
ydirlha rabi hal nchlh,Daridja
La semaine peut être une réussite ou un échec.,French
insan 3adi kifi kifkoum kamel,Daridja
Kayen far9 kbir binou w binha,Daridja
Basée aux Sables d'Olonne dans le département de la Vendée dans l'ouest de la France.,French
"Some are born great, some achieve greatness, and some have greatness thrust upon 'em.",English
f rejliya w idi kifah ndir bah yonqas sh7am w yabqa l7am,Daridja
Run the gauntlet,English
As pleased as Punch,English
Où sont les toilettes ?,French
Carte blanche,English
Pourquoi ne pas essayer de peindre un paysage français ?,French
wlidha rah mrid b bouchouka,Daridja
You can lead a whore to culture but you can't make her think,English
Shakespeare (phrases and sayings of),English
"I just bought a new car, and it's fantastic!",English
You look as if you've been dragged through a hedge backwards,English
mach Ghadi nssame7 9odam Rabi.,Daridja
À plus tard.,French
Une semaine sans plastique.,French
Quelle est ta région vinicole française préférée ?,French
Il est agréable de prendre un repas en plein air.,French
Quoi de neuf ?,French
As keen as mustard,English
kifach w bach nakolha w sah tchayan ?,Daridja
Mnytk 9aymi rohek y9aymek,Daridja
Les étoiles brillent comme des diamants dans le ciel.,French
Bonne nuit !,French
As happy as Larry,English
Les éclairs zèbrent le ciel pendant la tempête.,French
binom nta3o capable ymedlik kilyteh w may5alikch to93ed m3a binom nta3h,Daridja
A little bird told me,English
"Mais Marrie, que fait tu ici ?",French
"Il est moins quart, madame placard.",French
C'est un plaisir.,French
t9drou dirou hadouk l3fayes li khelitouhoum f 9lbkoum mli kountou sghar ..,Daridja
Twenty three skidoo,English
Blast from the past - A,English
The deadline for the project is on March 15th.,English
Il pleut.,French
Les éclairs illuminent le ciel sombre.,French
but nowadays we're teaming up with them to make a future where our human brains and robots work together.,English
Walk the walk,English
Off the record,English
Give me a high five ! ,English
Deja kbel kbelll mnkml ne9ra ,Daridja
Création B-arbre sur la table Film.,French
Il était toujours le premier dans sa classe.,French
Ghir ana fi dzayar li dar sujet 2 fi chari3a,Daridja
Je fais aussi des carottes au miel et des haricots verts aux amandes.,French
daret lhidjab,Daridja
Straight from the horse's mouth,English
hragtouli mokhi b la personalite ta3kom,Daridja
"Raindrops pattered on the roof, providing a soothing backdrop to the cozy evening.",English
The antique shop was filled with treasures from a bygone era.,English
la salle contient un vidéoprojecteur.,French
The CEO delivered an inspiring speech that motivated the entire company.,English
I see you stand like greyhounds in the slips,English
As different as chalk and cheese,English
Salam ... chrite pc jdid ,Daridja
t9ella9t bzf,Daridja
Où on discute des solutions écologiques aux problèmes tels que la pollution.,French
C'est formidable !,French
In a trice,English
"Back in 2017, WannaCry hit the scene like an uninvited guest at a party. ",English
a dely brahim wahed les burgers ,Daridja
Les risques associés à l'approche 1 sont :,French
Il y a eu quelque chose qui m'a fait encore plus réfléchir. ,French
Has the cat got your tongue?,English
vous mangez aussi souvent la même chose pour le déjeuner.,French
Wick - you get on my,English
"Hey, where did he go ?",English
ghir ana li malbsthomch wa9il,Daridja
Dog's bollocks,English
Son association lance un défi au public. ,French
J'aime la musique.,French
Eid mobarak bsaha w lahna 3likom,Daridja
bla mzia khti,Daridja
Salam khoty bghit ns9sikom,Daridja
"That's one small step for a man, a giant leap for mankind.",English
Quel est ton sport français préféré ?,French
Chokran khoya ayoub 3la lkhir dyalk li kadir,Daridja
"The diplomat negotiated a peace treaty, bringing an end to years of conflict.",English
Lo and behold,English
Je l'ai vu sur Internet ! dit Petit Poulet.,French
Bill Stickers is innocent,English
The butterfly gracefully danced from flower to flower in the garden.,English
ghir lazem nhabsou chwia ,Daridja
How do you know him ?,English
Strait-laced,English
Neither a borrower nor a lender be,English
blaaa mzeyaaa,Daridja
That movie was so boring; I almost fell asleep.,English
Écrire les requêtes SQL3 permettant de :,French
I have nothing to offer but blood toil tears and sweat.,English
La cuisine française offre une explosion de saveurs.,French
Une catastrophe naturelle.,French
How many apples are in the basket?,English
"Excuse me, where is the nearest post office?",English
ki kount sghir kount nel3ab b trab,Daridja
Kima t9ol mani bassane machi piscine,Daridja
Les adresses MAC comportent 6 octets (48 bits).,French
Ses amis l'appellent Petit Poulet. ,French
"Les couleurs de l'arc en ciel sont: le rouge, l'orange, le jaune, le vert, le blue et le violet.",French
"Dans un pays très loin,",French
Les plages de la Côte d'Azur sont magnifiques.,French
yakhi hala yakhi,Daridja
"Alors Petit Poulet, Pauline la poule.",French
w houma tarbiya rabi yjib,Daridja
We know where you live,English
Piece of the action,English
3id yal 3id w houma yakhedmou fel mounker,Daridja
ya3ni hadi mahich curiosité ,Daridja
Jma3a nahadro haja srx,Daridja
Nous avons un très grand jardin.,French
Où puis-je trouver un bon café ?,French
Plague on both your houses,English
El jism ta3i nqoss hmdllh mohem,Daridja
The Devil to pay,English
Where did the man go ?,English
Le dîner était exquis hier soir.,French
"Pour le gâteau pavlova, j'utilise de la crème fouettée, une mangue, des fraises, une banane, des fruits de la passion et des kiwis.",French
Malfa nchoufha,Daridja
C'est ennuyeux.,French
Birds of a feather flock together,English
Pull yourself up by your bootstraps,English
Quelle est ta région française préférée pour les sports d'hiver ?,French
Kifch system t3ha dyer,Daridja
Pourquoi ne pas essayer de déguster du vin dans une cave française ?,French
Buck stops here - The,English
Why didn't you tell me about the meeting tomorrow?,English
kifech rohtou hetta l temmak,Daridja
Le schéma SQL3 de cette base de données est le suivant :,French
Les maladies infectueuses se propagent très vite.,French
Vraiment ? Comment le savez-vous ? demande Carine.,French
"If music be the food of love, play on.",English
Elbow-grease,English
Doesn't know shit from Shinola.,English
There's no such thing as bad publicity.,English
Twelve good men and true,English
Il est agréable de flâner dans les marchés français.,French
As cute as a bug's ear,English
A zin win raki,Daridja
As white as snow,English
"The sunrise painted the sky in hues of pink and orange, signaling a new day.",English
(A) watched pot never boils.,English
"la tête, les épaules, les genoux, et les doigts.",French
"I'm willing to gift her a basket of flowers, what do you think ?",English
Why did you choose this restaurant for dinner?,English
car on sait tout ce qu'on doit faire chaque jour.,French
kifech mazelki tsaksi ya bent,Daridja
"fi had blad lwass3a macha'allah,",Daridja
on fait la même chose encore et encore.,French
yak teskoun hnaya lala ?,Daridja
ce n'est pas seulement des obligations ,French
Ashes to ashes dust to dust,English
Habit nspoty wa7ed ismo ya9ra esi 1cp sghir 3lya,Daridja
Maziid m najah w ta2alo9 weldi ljamil,Daridja
Il est devenu un père.,French
"Broke - if it ain't, don't fix it",English
rajla 3likoum w f7oulaaa 3likoummm w yasstehlou yatssamaw,Daridja
D'abord il envoie l'histoire par courriel à ses mille amis les plus proches. ,French
et3b eliha w Dirha  w mat9olsh kheli demain ..,Daridja
rah nakhdem projet b arduino,Daridja
"Age cannot wither her, nor custom stale her infinite variety",English
Jack Robinson - Before you can say,English
"The mountain climber conquered treacherous peaks, overcoming challenges along the way.",English
The jury is still out,English
barkoulah khawti rah  jabou,Daridja
"C'est une journée ensoleillée, parfaite pour un pique-nique.",French
Une série chronologique.,French
"Les 2 mlah, w les ressources ghiir homa f net",Daridja
On Carey Street,English
"Keep your chin up, legends never die.",English
J'aimerais visiter la Côte d'Azur un jour.,French
Die hard,English
mais aussi certaines choses qu'on choisit pour soi-même. ,French
mahash yekhelas lokn  manshekoush !!!,Daridja
Usual suspects - The,English
Les films français ont souvent des scénarios captivants.,French
J'écoutais la radio pendant que je faisais la vaisselle hier midi. ,French
wech rak ya kho ?,Daridja
Saqsi fel idara,Daridja
"9bal mankhrej, raddit darba l kol wa7ed Adani",Daridja
Pourquoi as-tu l'air fatigué ?,French
Thin air - Vanish into,English
Ouah ! Alors ça doit être vrai ! dit le renard. ,French
"ben aknoune, hydra, birkhadem ",Daridja
"The food is bland, the bread is soggy and the drink is not fresh !",English
"Ay ay ay, hbibna t9lbt ll3ba 3lih wa9il",Daridja
"Créer les tables objet, et orientation.",French
When is your birthday ?,English
High-flyer,English
C'est fou !,French
Cat out of the bag - Let the,English
Born with a silver spoon in one's mouth.,English
Cut to the chase,English
ya hesraaaah,Daridja
Raki fi 3aklak tssakssi hed la question ??,Daridja
Don't keep a dog and bark yourself!,English
"The ancient castle stood tall, a testament to a bygone era.",English
Quelle est ta destination de vacances préférée ?,French
et ils ont le même degré d'importance.,French
SLM rani nchof bli kayn li contre wa9fatna m3a l hirak,Daridja
lazam ndaf3o 3la 7ou9ou9na surtt psq soufrina bzzf had l 3am,Daridja
Les femmes d'abord.,French
,Daridja
la routine ça nous permet d'être plus productif ,French
"Les deux facteurs sont la fiabilité et la sécurité,",French
Il fait très chaud !,French
Ransomware : the malicious software that can turn your files into a digital hostage situation.,English
C'est difficile à croire.,French
Pourquoi ne pas essayer de préparer un plat français ce soir ?,French
Brownie points,English
Short end of the stick - The,English
ma3liche tselfili ,Daridja
 n9ol Cbn fo9 hagda makanch but oui kayn XDD,Daridja
Quelle est ta région française préférée pour les sports d'hiver ?,French
"The river meandered through the lush green valley, a lifeline for the ecosystem.",English
Where have you been ? I've been worried on you.,English
te3jebni kifah t9ari surtout ki makhalash hadok sam6at li y3ayo ysa9siw,Daridja
"En général, ce gâteau contient beaucoup de fruits secs et du rhum ou du porto. ",French
Ah les crocodiles.,French
Sorry sight,English
Coco is the best Disney movie.,English
l'ajout de nouveaux besoins sera plus facile,French
,Daridja
Drag race.,English
Pourquoi ne pas essayer une nouvelle recette de cuisine française ?,French
C'est que c'est le monument de Paris le plus engagé.,French
C'est étonnant.,French
Happy clappy,English
Wa9ila 3jbk l7al m3a lwl,Daridja
No laughing matter,English
J'aimerais visiter les vignobles de Bordeaux.,French
Wrong end of the stick - The,English
Knock into a cocked hat,English
hamdoullah bien w nta,Daridja
Bob's your uncle,English
Chkoun li kla mlenha déja,Daridja
"Rag, tag and bobtail",English
Panic stations,English
Market forces,English
Hit the ground running,English
rmilou lma tchoufi ma3andek ma diri b kchourr niff,Daridja
Be careful! The floor is slippery.,English
"Un cheval au singulier, les chevaux au pluriel.",French
houma liyefrzouk ykhalsou m3ak bessayf,Daridja
Children should be seen and not heard,English
w manich 3araf,Daridja
Lokan bahdaltouh w 9oltolo yraja3 drahem,Daridja
The neon lights of the city skyline illuminated the night with a vibrant glow.,English
"Oh, they have slain the Earl of Moray and Lady Mondegreen.",English
Les gens célèbrent la fête nationale en juillet.,French
chhal chabba hadik la chemise,Daridja
A man after my own heart,English
"Il faut faire la lessive, la vaisselle ou vider le lave-vaisselle. ",French
Les éclats de rire des enfants sont un trésor précieux.,French
Curate's egg,English
As snug as a bug in a rug,English
Famous for fifteen minutes,English
Eye candy - see ear candy,English
Pourquoi ne pas essayer un croissant au chocolat ?,French
Laissez un commentaire ci-dessous !,French
rah tewel w rah ykoun résultats ela hsab ete3b ta3ek,Daridja
cheft darna w charikti l nhar lakher.,Daridja
Laughter echoed through the air as friends gathered for a picnic in the park.,English
Zero tolerance for laziness.,English
Insérer tous les n-uplets nécessaires.,French
Point to point,English
Les croissants sont une spécialité française.,French
Slm nsaqsikoum svp hadak khobz souri,Daridja
Neither here nor there,English
Comment trouves-tu la poésie française ?,French
,Daridja
Thus far into the bowels of the land,English
Pound of flesh,English
C'est génial !,French
khellik m la3b w pubj w les jeux hadou,Daridja
Blow a raspberry - see raspberry tart,English
Is it true that you won the lottery?,English
ya khti raki 3ziza aftni 3la rohek,Daridja
Sweet Fanny Adams.,English
amira rahet l Dubai,Daridja
There's one (a sucker) born every minute,English
Raha hakmetni depression,Daridja
The aroma of freshly brewed coffee filled the cozy cafe.,English
One stop shop,English
C'est fantastique !,French
Ça dépend aussi si on est introverti ou extraverti. ,French
,Daridja
C'est incroyable !,French
"Alors dites-moi, ",French
"All singing, all dancing",English
Quelle est ta région française préférée pour la randonnée ?,French
The artist expressed emotions through brushstrokes on the canvas.,English
Foregone conclusion,English
Inna lillah wa inna ilayhi radji3oune.,Daridja
She wore a red dress that complemented her vibrant personality.,English
C'est facile.,French
"J'ai un lapin, une tortue et un poussin à la maison.",French
Les éclats de rire des enfants résonnent dans la cour de récréation.,French
Nice kettle of fish,English
Phénomènes d'attente: processus de naissance et de mort.,French
Stitch in time saves nine - A,English
Wlh ma la9ta dirha i7chem chwiya ,Daridja
"Durant l'été, l'oiseau et la baleine se retrouvaient dans la baie.",French
How much for that pillow ?,English
Don't change horses in midstream.,English
Run out of steam,English
Congratulations on your new job!,English
Une Conception détaillée,French
Bon sang ! Ça doit être vrai ! dit Pauline.,French
On souhaite implémenter une base de données.,French
Birds and the bees - The,English
A load of cobblers,English
"La vie de tous les jours,",French
La cuisine française offre une variété de fromages.,French
qui dit : LE CIEL EST EN TRAIN DE TOMBER !,French
"Out of sight, out of mind.",English
Qu'il a reçus sur le répondeur de France Inter. ,French
Dog's dinner,English
A place for everything and everything in its place,English
J'adore les croissants au petit-déjeuner.,French
Li rahetlou haja rahi 3and le bureau ta3 les agents,Daridja
How many languages do you speak fluently?,English
Les éclats de rire des enfants remplissent l'air.,French
Rub of the green,English
Put the mockers on,English
Le français est une langue élégante.,French
À quelle heure est le rendez-vous ?,French
Take the cake,English
Broad in the beam,English
"Salem 3likom khawti , ",Daridja
Les parcs sont parfaits pour une journée en plein air.,French
Exemple : 00-60-2F-3A-07-BC.,French
Certaines maisons sont climatisées mais chez moi n'ai pas l'air conditionné. ,French
No man is an island.,English
Comment cela marche ?,French
wach had lhala djaybinha hfada brk ..,Daridja
w 9lkoum dakhlin kamal f l exam !!!!!!!!,Daridja
Caught red-handed,English
All of a sudden,English
3id w 3wachir yema mrida w mathmlch bkat bdam3a wesh n9olkoum,Daridja
Going for a burton,English
ana daymen n'assuri belli rahom a l'aise,Daridja
C'est une surprise.,French
kharji la tarte bech matjiche barda bzf,Daridja
Joyeux Noël à vous !,French
Les oiseaux chantent dans le jardin.,French
koule 3am ou ntouma b 1000 khir nchlh ,Daridja
Read the riot act,English
Rani ghir hna,Daridja
Ear-mark,English
Il a le ventre bien gros et bien rond.,French
Raki tchofi f nas W nti mazalti tkhami wch mn gâteau ra7 diri,Daridja
Nothing is certain but death and taxes,English
La batterie est faible.,French
sh7al rahom ykhalsokk ? hhhhhh (guessra),Daridja
f hadouk ldjwayeh,Daridja
Bach yonssor l7a9 w nssor dolm.,Daridja
The engineer meticulously fine-tuned the machinery for optimal performance.,English
Baby blues.,English
Did you go to the movies ?,English
Il y a toujours des tâches ménagères à faire. ,French
Au sommet de la colline il y a une grande grotte sombre.,French
Wech rakou dirou? ,Daridja
Khawti Hada ftouri wa9il bzaf na9ass!,Daridja
Quel temps fait-il ?,French
"'Mohamed, anssa l'Algérie, c'est tag 3lemn tag, w li rah gader ygabel""",Daridja
Please pass me the salt from the kitchen counter.,English
rahet triciti,Daridja
yrahyah f darhom stp oumba3d diro wech thabo ,Daridja
Code d'enseignement et numéro de salle,French
"kol wa7d fi m9amo li khalani nekraha, ",Daridja
Far be it from me,English
The recipe requires 2 cups of sugar and 3 eggs.,English
yodokhlo bah yadahko 3lih w yabdaw yatbahalo,Daridja
"Excuse me, may I borrow your pen for a moment?",English
Great job on finishing the marathon!,English
It's better to give than to receive,English
Screw your courage to the sticking place,English
Où se trouve t-il ?,French
I'm so excited about the upcoming vacation!,English
La cuisine française utilise des ingrédients frais.,French
"Eye of newt and toe of frog, wool of bat and tongue of dog.",English
Réutiliser le noyau du logiciel.,French
No-brainer,English
C'est impressionnant.,French
plassa hadik ki lghaba,Daridja
Battle royal,English
J'aime la plage.,French
Left in the lurch,English
As tu déja essayé ce produit ?,French
Bon courage,French
C'est magique.,French
Point-and-click.,English
lyoum kayen match harb bin real wel barsa ,Daridja
Si x alors y sinon z.,French
Nous buvons de la bière ou du vin ou du champagne. ,French
W el 3ibra lel motta9in.,Daridja
matkhasarhach 3la wahdokhrin (machi ghir 1cp),Daridja
Hell or high water,English
"Salut, vous deux ! dit Carine. ",French
"Tout ça, ça fait aussi partie de notre routine.",French
eneshouni wsh ndir svp (bla tmes5ir srx ),Daridja
All the tea in China - Not for,English
Baker's dozen,English
Wolf in sheep's clothing,English
As fit as a butcher's dog,English
kayan bzzzf mahoch 3ajabhom lhal,Daridja
fi balo tfak le problem li kona nkhrjo 3la jalou,Daridja
nelqa khdma n3awen biha rouhi w nrbh l'expérience !,Daridja
Save one's bacon,English
Know the ropes,English
Foam at the mouth,English
Get the pip!,English
C'est dangereux.,French
Ya jma3a diro fbalkom,Daridja
Jump on the bandwagon,English
Les éclats de rire des enfants résonnent dans la cour d'école.,French
As XXX as YYY.,English
I'm smelling something fishy over here.,English
Pourquoi ne pas essayer la cuisine française ce soir ?,French
s7ab les langue mafihash wa9il hath el 3am,Daridja
b idhn allah ykhrjou fikoum .,Daridja
Elle est en train de se baigner.?,French
Aslan makountche temmak,Daridja
ga3 les direction  rahom yekhedmo  nrml apar bouraoui  !!!!,Daridja
"There is no alternative, right ?",English
"Ils sont où tes parents, jeune-homme ?",French
Words ending in gry,English
lah ybarek,Daridja
Le soleil brille et il fait beau.,French
Awah lhala marahiche ta3djeb,Daridja
Jobs for the boys,English
About turn,English
"If the mountain will not come to Muhammad, then Muhammad must go to the mountain.",English
hka bah madourouch 3lina wla hta 3la la grève ta3na.,Daridja
"Nous préférons les fruits de mer, les poissons et le jambon, le tout froid avec de la salade.",French
"w Sahbi lwa7id l nhar lakher, w ro7t. ",Daridja
Lock stock and barrel,English
loukan jiti godami nzidek,Daridja
Wellah ya khawti Ay efsa rak hab dirha,Daridja
Achilles' heel,English
hadak siyed li siya ga3 les fruits et légumes ,Daridja
KOL WA7ED YKHAMEM FI RO7AH,Daridja
Knuckle down,English
The athlete's perseverance paid off as he crossed the finish line with pride.,English
mazalou toujours yekhedem,Daridja
Get underway,English
À Moi Paris.,French
"On se brosse les dents, on se prépare, on s'habille, on prend son petit déjeuner. ",French
Cast the first stone,English
tawlet bzf mesbah w hna nessenaw f chems,Daridja
(il n'y a pas deux marques de même nom et tous les numéros sont uniques dans la base).,French
Les étoiles brillent dans le ciel nocturne.,French
goulilha tezreb chwia,Daridja
koun kamelti esmhom belkamel,Daridja
taeydou w tzidou b saha wel hna,Daridja
"Je dois acheter des crevettes, du poisson, du poulet, des fruits, des légumes et le jambon de Noël.",French
baghyin tedokhlo w tesokto,Daridja
Salam jma3a.,Daridja
Using a sledgehammer to crack a nut,English
pour moi lvide hada wasmo,Daridja
Could you add Stephanie to the chat ?,English
Go the whole hog,English
"Love is blind, isn't it ?",English
Quelle est ta région française préférée pour les vacances ?,French
You can't get blood out of a stone,English
Roh seguemelna lkhit,Daridja
wesh raykom fel formage hada ... coté gout/prix,Daridja
Truth is stranger than fiction,English
Hemdoulah ,Daridja
Fair to middling,English
hada bl mnhkiw 3la l probb ta3 les supports off,Daridja
"The detective carefully examined the clues, determined to solve the mysterious case.",English
"perso nmout ala le Couscous, Rechta w lem7adjeb",Daridja
"Aussi, j'achète de la glace à la vanille et du pain. ",French
9bal ma nssir 9ali El waled,Daridja
D'où la conclusion qu'on a tiré.,French
The coastal town was known for its picturesque beaches and quaint charm.,English
Not rocket science,English
Keep your hands clean!,English
"Pour beaucoup d'entre nous, ",French
Galou Egybest rja3 mana3ref sah wella khorti,Daridja
bech dok naklou bla ma nkhafo lol,Daridja
Alah yarahmak ya yemma el aziza,Daridja
lazem sber psq marahche djik wsh hab bin lila w nhar,Daridja
Les gens qui me connaissent savent que j'adore écouter la radio. ,French
loukan takhtikoum 9raya tmoutou..,Daridja
Jean a deux garçon et une fille.,French
Crocodile tears,English
(Coming in) on a wing and a prayer,English
"Oui, un peu.",French
The collywobbles,English
Petit Poulet est un poulet tout à fait normal.,French
Spelling-bee,English
I can't believe it's already 2024!,English
Good man is hard to find - A,English
"On passe ensuite la majeure partie de notre journée au travail, ",French
On cloud nine,English
Bane of your life,English
Quel est ton nom ?,French
koul wehd serbilou teht bab,Daridja
Il faut le faire en avance. ,French
Du point de vue des contrôles antidopage. ,French
fi 3amro 15 ans bérk merci.,Daridja
C'est interdit.,French
hatta lwa9tach w mtouma ta7fdo w li ydirouh fikoum 9ablin..,Daridja
C'est une émission au sujet de l'environnement.,French
Take (with a spoon) a little bit of salt.,English
Nous sommes en sécurité.,French
Rabi yahdik hata kitachki malik ykamlou 3lik,Daridja
Eddar Darkom ,Daridja
L'éléphant est un très grand animal.,French
Cat got your tongue?,English
"aand rabbi fi balhom haja sghira bssah aand rabbi kbiiiiira,",Daridja
