Sentence,Language
Il aimait la façon gracieuse qu'elle avait de nager dans l'eau.,French
Famous last words (dying statements of famous people - a list),English
Shakers and movers,English
La musique française a une mélodie unique.,French
crient-ils tous ensemble.,French
dir kamel wesh hab tet3lmou,Daridja
capable t'acceptik w capable no,Daridja
Il est agréable de passer du temps dans les cafés français.,French
Pourquoi ne pas essayer une nouvelle recette de pâtisserie française ?,French
C'était un jour férié en France.,French
Do unto others as you would have them do to you.,English
ASIMO seamlessly blended elegance and functionality with its remarkably human-like mobility.,English
dakhletli chahria,Daridja
Charmed life,English
Ils aimaient tous les deux manger beaucoup de petits poissons.,French
In the twinkling of an eye,English
Pourquoi ne pas essayer de visiter un village français pittoresque ?,French
"Il fait froid, n'est-ce pas ?",French
Man's inhumanity to man.,English
whda chhal fiha men caloris,Daridja
wa9il rah nhabes,Daridja
"Pour ne pas être déprimé par le métro boulot dodo, ",French
tol 3la el sa7a el faniya nn,Daridja
man nadra ta3ak machi kamal ykhamo kifak,Daridja
Wear the trousers!,English
How do you do?,English
Fine words butter no parsnips.,English
Projet complexe et/ou critique avec risques.,French
Merci beaucoup.,French
Khrej wehdou w 9rib rataha,Daridja
Qu'est-ce que vous faîtes pour Noël ? ,French
ya kho ana rani nahki wash chaft,Daridja
Long in the tooth,English
Comment ça va ?,French
(7acha li maysstahloch) ,Daridja
heda wa9il jabouh clown yne7i 3la les joueures,Daridja
Excusez-moi.,French
darkom labess khawtek ga3 ca va ?,Daridja
Wikta tetlagna,Daridja
Touch with a barge-pole - Wouldn't,English
wech 7walkom ? ,Daridja
Season of mists and mellow fruitfulness,English
Pip - Get the/got the /have the,English
Les rivières françaises offrent des paysages paisibles.,French
It came like a bolt from the blue,English
"C'est une journée ensoleillée, parfaite pour un pique-nique.",French
momba3d yjo chi ghashi,Daridja
ou makethroch men l7am hein !,Daridja
The hair of the dog that bit you,English
Aren't you two related ?,English
On n'a pas le temps pour la poésie.,French
3andi les gaz f kerchi w zedet kharjet ktar men li kanet,Daridja
Something for the weekend sir?,English
Generation X,English
Knight in shining armour,English
On mange souvent avec les mêmes collègues. ,French
Je suis content.,French
netlagaw ce weekend nchallah,Daridja
Les éclats de rire des enfants sont contagieux.,French
"(nchlh maykoun ghir lkhir),",Daridja
"ness li ydjiw l abn w yero9do,",Daridja
"There but for the grace of God, go I",English
Tomorrow is another day,English
Pendant une semaine.,French
ra7 n3od ndir mindak des FreeStyle,Daridja
awra kima hadi Alah yakta3ha,Daridja
ma 3endkoumch karama ni ma3na,Daridja
"kebda , merguez",Daridja
No more cakes and ale?,English
Insérer le cours et les types.,French
"Hey, let's play some minecraft tonight.",English
"GHADWA MAFIHACH GRÈVE FE L'ESI,",Daridja
3awed checki hada spott madabik,Daridja
"Après les desserts, nous nous reposons dans le salon.",French
elmohim rabi m3akom hadi hiya el3ibad m3afen rabi wkilhom,Daridja
"S'il vous plaît monsieur, comment aller à la forêt ?",French
Women and children first,English
Où sont passées mes lunettes de soleil ?,French
Ki nkbaro nhiro wch sari,Daridja
More bang for your buck,English
Davy Jones' locker,English
Bacon - Bring home the,English
Warts and all,English
c'est un processus de reflexion pour la résolution,French
"Mais ne vous inquiétez pas, les amis, je connais la cachette parfaite. ",French
"hemdoulah ya rebi ,",Daridja
"C'est une journée ensoleillée, idéale pour une sortie en plein air.",French
La flemme.,French
Beauty is in the eye of the beholder,English
Have you ever traveled to Asia?,English
Tooo big for your breeches,English
hekmatou el hemma,Daridja
Butterfingers,English
est-ce que vous aimez la routine ? ,French
Slt esq ki naawed nmarki nkhls lmondat brk Wla njib kml le dossier,Daridja
Crack of doom - The,English
Spare the rod and spoil the child,English
Je cite :  Quel est le principe ? ,French
Kayen li ykhafou 3ayn allah yssahal 3la koul wahed,Daridja
"If you think that, you have another thing coming ...",English
Ladies' room,English
Où est-ce que tu as mis tes clés ?,French
Rabbi maakom w li darha ykhelessha ghaaalya,Daridja
(malheureusement bla masstfadna menha).,Daridja
Les rivières françaises sont paisibles.,French
c'est bien de prendre le temps d'apprécier les petits moments.,French
Prick up your ears,English
Against the grain,English
Hada wesh tssalni l blad.,Daridja
hakka galet,Daridja
kech tssawer,Daridja
"Horse, a horse, my kingdom for a horse.",English
"Papa, j'ai soif !",French
Plain sailing,English
ntmena mdjmi3 whd 9dim wla jdid ,Daridja
( li ypi3o telephonate),Daridja
Expliquer les requêtes suivantes,French
"3la 7ssab mon exp (li m3ndha hâta m3na bnissba lel ba3d),",Daridja
"Le long de la route, à travers le champ et en haut d'une colline. ",French
Many a little makes a mickle,English
Let the cat out of the bag,English
Kount n9ol jamais ha nt3lm hada ,Daridja
azul fellawen ,Daridja
Grace of God - There but for ...,English
Les palesténiens vivent dans des conditions misérables.,French
Bee-line - make a bee-line for,English
Pourquoi ne pas essayer la pâtisserie française ?,French
had lmarra zelguet menni,Daridja
Turn of phrase,English
Household words,English
Could you please answer the phone ?,English
Flesh and blood,English
okol kayan li yadironja matchofach lhala ,Daridja
El Djelfa rahi deyra el buzz,Daridja
ASLAN TERBA7 GHIR L3AYB ,Daridja
Jack - phrases that include the name Jack,English
ça va bien ?,French
Get off on the wrong foot,English
The temperature dropped to -5 degrees last night.,English
Il faut prendre le train pour aller là-bas.,French
Run of the mill,English
C'est magnifique !,French
Never-never land,English
The moving finger writes,English
It's raining cats and dogs!,English
Je suis fatigué.,French
Wech raykon fel bescuit hada,Daridja
the 9th degree.,English
A woman needs a man like a fish needs a bicycle.,English
Knock off,English
The fashion designer showcased a collection that pushed the boundaries of creativity.,English
marhba bikom,Daridja
"Le volontaire s'engage à ne pas utiliser ou acheter des produits emballés (plastique, cellophane?), ",French
Tu devrais lire ce livre fascinant.,French
Back to basics,English
Riding shotgun,English
une séquence est une sous séquence d'une autre,French
Two cents worth,English
Qui décrit la gestion simplifiée des enseignements.,French
Mn nhar lowl li dkhlt Fih l'esi,Daridja
"My flight is at 7:30 AM, so I need to leave early.",English
The customer is always right,English
La fenêtre s'ouvre soudainement ...,French
Slm khoya tqdr t7tli  hadou lel bi3,Daridja
Les éclairs illuminent le ciel pendant l'orage.,French
"Chaque jour, on se lève tôt le matin. ",French
Il est difficile de prononcer certains mots français.,French
Bread always falls buttered side down,English
A la fin de l'émission le présentateur passe quelques messages.,French
Quand est-ce que tu rentres à la maison ?,French
Put up your dukes,English
Should I drop you in here ?,English
"Il voit une histoire terrifiante avec un titre terrifiant, ",French
esq nrml nakoul whda fel ftour berk ??,Daridja
kech afkar te3 decor ,Daridja
"If you can't stand the heat, get out of the kitchen",English
"Il n'est ni grand, ni petit. ",French
Coucou les gens.,French
Winter drawers on,English
avec les 16 lignes du tableau ci-dessous,French
edhab rah yemchi w yzid yeghla,Daridja
Comes to the crunch - (When it),English
I can't find my keys anywhere; have you seen them?,English
Fell swoop - At one day,English
Pourquoi ne pas essayer de cuisiner une spécialité française ?,French
Slam rani baghya ncmondi kima hadi pour 10 person,Daridja
seb7ane allah,Daridja
"En général, il fait très chaud le jour de Noël en Australie. ",French
Happy slapping,English
Jabolna khobz na9es klaw meno deja,Daridja
Here lies one whose name is writ in water.,English
"Friends embarked on a road trip, eager for adventure and new experiences.",English
Less is more,English
Necessity is the mother of invention.,English
For ever and a day,English
(The) penny drops,English
Bech wahed mayzid ytemeskher bikom,Daridja
"Machi lazame tahdar, afarhilha o khelasse",Daridja
mais c'est aussi rempli de petits moments de bonheur et de joie. ,French
Mezlt ma9ritech hadak l cour,Daridja
"Dans la salade, il y a de la laitue, des tomates, des pommes de terre et du poivron. ",French
Petit Poulet et Pauline la poule courent alors ensemble sur la route vers le marais.,French
It is meat and drink to me,English
The poet penned verses that captured the essence of love and longing.,English
Fanny Adams - Sweet,English
Star-crossed lovers,English
I'm stumped and shocked,English
Got my mojo working,English
Les éclairs zèbrent le ciel pendant l'orage d'été.,French
C'est trop cher.,French
Les étoiles scintillent dans le ciel étoilé.,French
I'll be there with bells on,English
Wa9il chaf les photos tawa3na haya 3ajbatou moldova,Daridja
As easy as pie,English
The proof of the pudding is in the eating,English
"Le mois dernier, j'ai cuisiné le gâteau de Noël. ",French
kch groupe telegram t9raw fih wt7ato fih les sujets,Daridja
Have you ever met a celebrity in person?,English
Keep up with the Joneses,English
Sma nhdbo bles seamines,Daridja
Quelle est ta ville française préférée ?,French
"L'été dernier, nous avons visité Paris.",French
Dressed to the nines,English
Stop! Don't open that door without permission.,English
C'est la vie.,French
marahch yhez ,Daridja
"Bonjour, Petit Poulet ! dit Pauline.",French
C'est un rêve.,French
chkon khir min na7iyat resources w mna...,Daridja
The cut of your jib,English
Wellah danya la madirch 9imak l ro7ak wahad la ydirhalak.,Daridja
Keep at bay,English
"Mon grand-père a 10 vaches, 20 agneaux, et 30 poulets.",French
P.D.Q. - pretty damn quick,English
bah ngolo nta les hommes,Daridja
You're invited to our housewarming party on Saturday.,English
Les éclairs illuminent le ciel pendant l'orage d'été.,French
"bkito fi 7yati,",Daridja
What's the capital of Australia?,English
Trouver le nombre de contrôles positifs par athlète.,French
Pourquoi ne pas essayer de visiter un marché français ?,French
Why did you choose this career path?,English
Boogie-woogie,English
Quel est ton sport préféré ?,French
Politically correct,English
No quarter given,English
"En arrivant au marais, ils rencontrent Carine la cane. ",French
Le ciel ne nous tombera pas dessus ici. ,French
LA GRÈVE MAHABSATCH MAZALHA MKAMLA.,Daridja
Il était un enfant très talentueux.,French
Disent Petit Poulet et Pauline ensemble.,French
(The) order of the boot,English
Les musées français regorgent d'histoire.,French
Lackadaisical,English
Freeze the balls off a brass monkey - cold enough to,English
Où est la plage ?,French
"He meticulously arranged the books on the shelf, creating a perfect display.",English
La cuisine française est réputée pour sa délicatesse.,French
Ecole Supérieure en Sciences et Technologies de l'Informatique et du Numérique,French
Loose lips sink ships,English
Soit le schéma objet ci-après.,French
Stp khoya partagiha ,Daridja
Il y a assez de place pour tout le monde !,French
"A lone wolf howled in the distance, echoing through the silent forest.",English
ya kho ana manekdebche alik,Daridja
Ends of the earth - The,English
Stop shouting! I can hear you just fine.,English
gallek lweekend ljay tssob chta,Daridja
w hewedti mn loto .,Daridja
ghir fahmouni kifach rahi tbanelkom ,Daridja
A house divided against itself cannot stand,English
"The hiker reached the summit, taking in the breathtaking view from the peak.",English
correspondante au schéma conceptuel ci-dessous ,French
On the warpath,English
wah ki rak khouya ghaya,Daridja
Whole-hearted,English
"Pour certains, si vous avez des enfants, vous devez aussi les préparer, ",French
Is the Pope Catholic?,English
Raspberry tart,English
Yemma kherdjet lbarra ,Daridja
Les montagnes sont recouvertes de neige.,French
Bee in your bonnet,English
plusieurs modifications vont être apportées,French
Nssiti bech teddi sachet l mamak,Daridja
GHIR KOUNKOM HANYIN,Daridja
How are the mighty fallen?,English
The fly in the ointment,English
It moves around like a champ! ,English
On décide d'ajouter au voilier décrit à la question précédente.,French
"Déjà, j'aimerais réécouter cela sur le site internet de France Inter quand j'aurai le temps.",French
Bunch of weirdos.,English
Devil take the hindmost - The,English
7a tetla9aw bzzf 3ibad hkda,Daridja
Les étoiles brillent dans la nuit étoilée.,French
HADA SBAB L'ALGERIE LI GA3DA TALYA NTOUMA W NAS LI KIMA NTOUMA,Daridja
salam 7abit nspoti hadak lbanadam li rah mconsomi,Daridja
Quel est le mot français le plus difficile à prononcer ?,French
Les cascades dans les montagnes sont impressionnantes.,French
Kechma htejti ?,Daridja
Chit-chat,English
ramdan had l3am ,Daridja
Une Conception générale,French
Cold enough to freeze the balls off a brass monkey.,English
Les éclairs zèbrent le ciel pendant l'orage d'été.,French
High horse - get off your,English
Pull up stakes,English
Penny saved is a penny earned.,English
kach mahakmin 3likoum ??,Daridja
kesh oukla bninaaaa ???,Daridja
7bibi 3ach men chafek hadi ghiba,Daridja
My name's Bond. James Bond.,English
"En fin de compte, ",French
derna ftor fooor lyoum,Daridja
Pourquoi ne pas essayer une nouvelle recette de cuisine française ?,French
Genius is one percent inspiration and 99 percent perspiration.,English
Nombre d'hôtes par réseau (adresses utilisables).,French
Absence makes the heart grow fonder,English
Mes parents boivent du thé. À Noël nous mangeons toujours trop.,French
il faut les promener avant de partir au travail.,French
(By the) skin of your teeth,English
c'est souvent ce qu'on appelle la routine. ,French
esq c possible nbloki mor  le mois de ramadan ?,Daridja
CBon khawti rani khdiit 9arari Elli howa nhbss El RAP,Daridja
What you see is what you get - wysiwyg,English
yaw fi9ou dakoumm lwad fi9ouuuuuuuuuu,Daridja
The die has been cast,English
Vraiment ? Comment le savez-vous ? demande Roger.,French
RANA NE9RAK FI HAJA ASLAN MAKACH MENHA KEBRO CHWIYA,Daridja
Below the salt,English
Le soleil se couche lentement à l'horizon.,French
Cold shoulder,English
Don't go there,English
Can you believe we've known each other for 15 years?,English
rabi yarahmek yemma,Daridja
"cette routine peut se résumer en trois mots : métro, boulot, dodo. ",French
"Hark, hark! the lark at heaven's gate sings",English
C'était une expérience culinaire exceptionnelle.,French
As pure as the driven snow,English
il y a 120 pays dans le monde qui ont repris l'idée de la Fête de la Musique.,French
Où as-tu appris à cuisiner comme ça ?,French
Ps and Qs - Mind your,English
A load of codswallop,English
Il est agréable de flâner dans les marchés français.,French
Réalisation et test d'intégration,French
Créer les types correspondant à ce diagramme UML.,French
The chef skillfully prepared a gourmet meal that delighted the taste buds.,English
Le garçon va à l'école.,French
Like the clappers,English
lyoum choft wahda dir hijab 3andeha lahja nta3 wahda mal gharb,Daridja
Rana dayrinelkom promotion hbaaal ! ,Daridja
"Something old, something new, something borrowed, something blue.",English
Whole nine yards - The,English
He's got a third degree burn. Poor man !,English
The bustling city streets were alive with the sounds of honking horns and chatter.,English
Khada3ine maysfawach m3a rabi,Daridja
Dieu merci.,French
C'est délicieux.,French
Il n'est ni intelligent ni stupide. ,French
Did you watch the new Barbie movie ?,English
The female of the species is more deadly then the male,English
hadi hia trig li nfout menha koul youm,Daridja
Il est agréable de se promener le long de la Seine.,French
C'est bizarre.,French
Boss eyed,English
"Balak kechma ybedl fikom, w fiya inshallah",Daridja
loukan zad chwia ykserlek ydek !!!!!!,Daridja
Le globe terrestre.,French
"Keep secure, little warriors !",English
mazalha mkamla w manach mhabsin,Daridja
Sixes and sevens - At,English
Les extravertis aiment passer du temps à l'extérieur. ,French
yjib chbab bzf tricot hadek,Daridja
Tous les enfants aiment jouer.,French
"hasbin roh'hom 3aychin wahedhom. 9albi dar, ",Daridja
ramdan karim,Daridja
Red sky at night ...,English
rahi tdir bzf had lyamat,Daridja
"Waves crashed against the shore, creating a rhythmic melody of nature.",English
Où est la gare ?,French
avanci chwia douk telgah temma,Daridja
Get on my wick,English
li ykon ya9ra w ychof nas zadma,Daridja
C'est fantastique !,French
"w nakrah kol 7aja 3andha 3la9a biha Wella tfekrni fiha, ",Daridja
Run a mile,English
jeweznaha w 9olna ma3lich,Daridja
Ce nombre décimal représente une valeur entre 0 à 255.,French
"Frailty, thy name is woman",English
Lokan ana natla3 nkhlteha 3lihom w njib wa7da manhom tna9iha,Daridja
li nawi ghdwa yji bach yrayah bera wela ychad 2 playes,Daridja
rani rayeh net3acha,Daridja
zedet hiya habtat bech techri lma,Daridja
Ça suffit.,French
Pourquoi ne pas essayer une nouvelle recette de cuisine française ?,French
Pourquoi ne pas essayer une recette française ?,French
Wild and woolly,English
wa9il hadi khiir ??,Daridja
Elle est trop belle.,French
Mad as a march hare,English
Caught by the short hairs,English
Tail wagging the dog - The,English
Rumpy-pumpy,English
Michael is the best boos ever.,English
A sorry sight,English
Sound out,English
The mutt's nuts,English
rahi yahafdek khouya,Daridja
Put your back up,English
wela NTI Ida ma Kayen walo binatkom kifech 9 mois ma tetlakawch,Daridja
Pour les enseignements nécessitant un vidéoprojecteur.,French
"Puis à minuit, on allume la grande fouée de la St Jean.",French
Je t'aime.,French
Comment tu le trouve ?,French
Quel est ton plat français préféré ?,French
C'est drôle.,French
w makoumch ha dirouhoum kamal m3a proff ,Daridja
Les éclats de rire sont la meilleure thérapie.,French
A fool's paradise,English
fi hadik dkika tahbti man tomobile ou matwalich lour kml ,Daridja
Comment trouves-tu la culture française ?,French
Four corners of the earth,English
kriit w cheftha kima f ls photos,Daridja
Grib nossel wejdou rwahtikom,Daridja
C'est délicieux !,French
Les rues de la vieille ville sont charmantes.,French
Il était une fois ...,French
Soixante six-mille et cinq-cents quarante trois.,French
I can't wait for the weekend to relax.,English
Pourquoi ne pas essayer une nouvelle recette de pâtisserie française ?,French
Top notch,English
Say cheese!,English
Female of the species is more deadly than the male.,English
Students eagerly listened as the professor shared insights during the lecture.,English
Famous last words (the ironic phrase).,English
hakka hab y9oul ey wahad ya93d f edar w ya7fad ywali tbibbb,Daridja
Beat a hasty retreat,English
Je l'ai vu sur Internet ! dit Petit Poulet.,French
Chain is only as strong as its weakest link - A,English
Oh my goodness! Look at that adorable puppy!,English
Nous ne le savons pas vraiment. ,French
All fingers and thumbs and toes.,English
"Si vous avez un ou plusieurs chiens, ",French
Angry young man and a senior citizen.,English
What are you doing here Tom ?,English
Et Wellah ya khawti bli fhad denya hadja ma impossible I swear ... ,Daridja
The orchestra played a symphony that transported the audience to another realm.,English
C'était une journée pluvieuse et froide.,French
Curiosity killed the cat,English
"Avant le déjeuner, je mets les assiettes, les verres, les fourchettes, les couteaux et les cuillères sur la table. ",French
Many are called but few are chosen.,English
Put the wood in the hole,English
J'ai acheté une nouvelle robe aujourd'hui.,French
L3am hadak ali ma7abch yakhlass enfin khlass,Daridja
C'est trop mignon.,French
asber mor les Cis wa etlg had spot balak tbedl rayek,Daridja
The philanthropist dedicated their life to making a positive impact on society.,English
W hassbiya Allah w ni3ma lwakil.,Daridja
You'll wonder where the yellow went when you brush your teeth with Pepsodent.,English
Your name is mud,English
Fight fire with fire,English
Li y3ref kifch nrouh mn bbz l dar El beida a pied  bla mnjouz 3la stop y9oli svp,Daridja
Tempest in a teapot,English
darou film pour enfants f mbc 3,Daridja
As fine as frog's hair,English
J'aime lire.,French
"Verbosity leads to unclear, inarticulate things.",English
"Wow, that was an amazing performance!",English
Le film était captivant de bout en bout.,French
Quel est ton artiste français préféré ?,French
"Bonjour, comment ça va ?",French
wella fi la chaine nta3i,Daridja
Bsh 3lach twarilna hna tani,Daridja
Keepy-uppy,English
Life's not all beer and skittles,English
You can't teach an old dog new tricks.,English
"En 2017, premier tour des élections est fixé au dimanche 23 Avril.",French
Alors l'année dernière nous avons déjeuné dans le jardin.,French
"discuter avec nos amis, ",French
wlh yaw jit mennek ndir haka,Daridja
J'habite à Lyon.,French
l9ak 3a9la bezaf koun fl blas hatitilah wsakh wednih,Daridja
Spécifications et analyse,French
L'adjectif suit son nom en nombre et en genre.,French
Where did the mouse hide ?,English
kelektini ysewed sa3dek,Daridja
Nine days' wonder,English
A fish out of water.,English
Dog is a man's best friend,English
Salam oualikoum wa rahmat ellah wa barakatouh,Daridja
It's better to light a candle than curse the darkness.,English
"S'il vous plaît, comment aller à la banque ?",French
Out of the mouths of babes and sucklings.,English
What's your favorite book of all time?,English
Hand over fist,English
Man who is his own lawyer has a fool for a client.,English
Behind every great man there's a great woman,English
il y a toujours des choses à faire. ,French
Main chance,English
The concert starts at 8 o'clock sharp.,English
"Maman, j'ai faim !",French
Voici ses devoirs: un déjeuner de Noël typiquement australien.,French
C'est dommage.,French
Men's evil manners live in brass; their virtues we write in water.,English
(Ask not) for whom the bell tolls,English
Il est important de respecter les traditions.,French
trig twila matekhlasche,Daridja
À la prochaine.,French
Slm khawti voila 3andi wahéd sahbi rahou mrid,Daridja
Don't forget to bring your passport for the trip.,English
Wlh c grave mazalo kayan nas hak hawji,Daridja
The comedian delivered jokes that had the audience roaring with laughter.,English
Il est agréable de se promener dans les jardins français.,French
hka bah maylas9ouhach fina wla yalgawna seba biha bah yhabsouna.,Daridja
wekteh nebda ndakhalalha djej w l7am?,Daridja
Les rivières françaises serpentent à travers la campagne.,French
Shot heard 'round the world.,English
How do you find your food sir ?,English
Donnez le code nécessaire pour réaliser cette opération.,French
"Ouest France (en fait, le plus grand journal régional français).",French
"3la hada decidit nkhali kolch men wraya,",Daridja
A safe pair of hands.,English
Is honesty really is the best policy ?,English
Ena dok nroh nmout,Daridja
How many siblings do you have?,English
Mutt's nuts - The,English
Mais je vais vous dire une chose : Gérard le Renard est très heureux. ,French
"Goody, goody gumdrops",English
"Quand on est finalement à la maison, ",French
( Ma9rouna bel 3allouche Krouma ),Daridja
Thorn in the flesh,English
Without let or hindrance,English
Latin Phrases,English
High on the hog,English
Jma3a li raha tgol makonach nharcho,Daridja
Pourquoi ne pas essayer de danser sur de la musique française ?,French
Drop-dead gorgeous,English
Les éclats de rire sont le meilleur remède.,French
Mon étudiante par Skype Robyn est Australienne.,French
"Mais après ça, vers la fin de l'émission.",French
Horse and cart,English
Put your nose out of joint,English
Le régime stationnaire.,French
Son mandat durera 5 ans.,French
The train is scheduled to arrive at 3:45 PM.,English
C'est un monsieur de l'association ?Tous dans l'même bateau' ,French
saha eidkom la fam,Daridja
Different kettle of fish,English
Les éclats de rire sont une musique joyeuse.,French
"Non, pas du tout.",French
bech ychoufou niveau ta3ek,Daridja
Did you see the stunning sunset yesterday?,English
"Il est où le bonheur, il est où ?",French
Adressage IPv4 (logique).,French
Elle est très jolie.,French
Above board,English
w mazal raki tsa9ssi w ga3,Daridja
Slt goulili kifah mn tafora nosel la BN svp,Daridja
Fall on your sword,English
"He who can, does; he who cannot, teaches.",English
Hot off the press,English
hadik tatfatat whdha !,Daridja
Vraiment ? Comment le sais-tu ? demande Pauline.,French
A fish rots from the head down,English
3andi wlad khti ,Daridja
How sharper than a serpent's tooth it is to have a thankless child.,English
C'est agréable.,French
The whole shebang,English
chokran mosba9an,Daridja
Les éclairs zèbrent le ciel pendant l'orage d'été.,French
Les châteaux français sont chargés d'histoire.,French
ghadhtni 3omri yaaaaaa,Daridja
Les éclats de rire sont une musique joyeuse.,French
peut-être aller à la salle de sport ? ,French
Je suis occupé.,French
la durée de vie doit être importante,French
Pour le déjeuner de Noël nous n'avons pas de nourriture chaude. ,French
7allou fast food jdid,Daridja
Où sont-ils allés ? ,French
For all intents and purposes.,English
Nass yaklou T3am bl'L7am,Daridja
L'introduction d'un processus stochastique défini de façon appropriée.,French
NOUS L'AVONS VU SUR INTERNET.,French
Pourquoi ne pas essayer une nouvelle recette française ?,French
"To sleep: perchance to dream: ay, there's the rub",English
Eehhhh d9i9a bark rani ne9ra mlih ?????? ,Daridja
Tall story,English
Spill the beans.,English
Feather in one's cap - A,English
dert pfe khdma chaba w doka t3lmet ,Daridja
