Sentence,Language
Il lit les nouvelles.,French
ajmal haja f denia post control w zidlo dar,Daridja
"Si on n'a rien de prêt pour le diner, ",French
Another bad hair day.,English
Salam oualikoum wa rahmat ellah wa barakatouh,Daridja
"faire des courses, aller chercher les enfants à l'école, ",French
bedloulha le prix ... tla3 bezzaaaf,Daridja
More honoured in the breach than in the observance.,English
Ship shape and Bristol fashion,English
donc khliwlna ndiro sondage khir w khir .,Daridja
nakhdmo nassna b chi li na9dro alih,Daridja
If the cap fits,English
Dark horse,English
Aaah ya sarah,Daridja
Powers that be - The generated text,English
Come a cropper,English
D3awi li ditihoum had l3id ,Daridja
Pourquoi ne pas apprendre quelques expressions françaises utiles ?,French
Qu'est ce qui ce passe t-il ?,French
C'est une belle journée pour une promenade.,French
Mach Ghadi nssame7 li kan fi ydo l7a9,Daridja
Il faut visiter le Louvre à Paris.,French
Red-handed (caught),English
Old chestnut,English
Les couleurs de l'automne sont splendides.,French
Il fait très froid !,French
The buck stops here,English
Pas de problème.,French
Bonté divine ! Ça doit être vrai ! ,French
Exception that proves the rule.,English
Till the cows come home,English
"kima bghaw ydaroni, Wella y'adoni, ",Daridja
Bsr zinounin,Daridja
Tu parles français ?,French
Be quiet! The baby is sleeping.,English
c'est vite le chaos dans la maison.,French
Under your hat - Keep it,English
"C'est une journée froide, idéale pour une soirée au coin du feu.",French
"Et Petit Poulet, Pauline la poule, ",French
salam cv rani lbarra,Daridja
Barking mad,English
Brass monkey weather,English
"Wow, your garden looks absolutely stunning!",English
La fête date de 1982.,French
kbir w sghir,Daridja
"A gentle breeze rustled the leaves on the trees, signaling the arrival of spring.",English
Is the Pope Polish?,English
Quelle heure est-il ?,French
Les plages de la Côte d'Azur sont magnifiques.,French
Better half,English
W mn lyom w ro7 marakom ra7 Tzido telgaw ayé ghnaya mn ghnayati fi l'YouTub ,Daridja
ndkhol f domaine hada w marahche nbedlou nshallah ,Daridja
"La veille de Noël, je fais des courses. ",French
C'est triste.,French
Kant tjowz hadak l 3am w arwah,Daridja
Friend in need is a friend indeed - An old saying,English
W mn el asbab li khalatni n7abes ,Daridja
Up to snuff,English
Je ne sais pas.,French
nhar kamel w nta tbeki,Daridja
Carbon-copy,English
Hab nechri tomobile ,Daridja
Best laid schemes of mice and men - The Fellow traveller,English
Spitting feathers,English
Beyond our ken,English
"Spreading to over 200,000 computers across 150 countries.",English
"Après ça, il est temps de se rendre au travail. ",French
Les rues de Paris sont pleines de vie.,French
Kick the bucket,English
Survival of the fittest,English
ta3ah mjit 9ahwat louh ,Daridja
Koul wahd ydir wsh yheb chfto yza3e9,Daridja
Comment s'est passée ta journée ?,French
Il est toujours bon de rire un peu.,French
Les étoiles brillent dans le ciel nocturne.,French
For whom the bell tolls,English
Night owl,English
Où allez-vous ? Pourquoi avez-vous si peur ?,French
Les éclats de rire des enfants résonnent dans la cour d'école.,French
"Il n'est ni gros, ni maigre. ",French
Can you believe it's been 10 years since we graduated?,English
Il vous est demandé d'implémenter une base de données ,French
Pourquoi ne pas essayer un plat traditionnel français ce soir ?,French
Rahet l'internet,Daridja
Quatre-vingts dix-septs,French
Laissez-moi vous raconter l'histoire d'un Poulet. ,French
nti lazem tchoufi wech ysa3dek,Daridja
Les coûts peuvent augmenter en raison des itérations (plus complexes à gérer).,French
I will swing for you,English
wech n9olkom tban une piscine kbira w el hala n9ia,Daridja
nonqs mn playc ma nhabh nonqas manhom,Daridja
J'adore Paris.,French
C'est formidable !,French
Two heads are better than one,English
haka yebda y3ayet bla sebba ma3naha raho mkhabi haja,Daridja
Je préfère le café avec un peu de lait.,French
"les habiller, leur donner un petit déjeuner ",French
wa9il n9ost 0'5kg BRK f un mois,Daridja
khawti li lga mfateh f la bib ycontactini svp,Daridja
"Colleagues collaborated on a project, pooling their expertise for success.",English
C'est fantastique !,French
"7bit nseqsikm , ki jit nechri boutaille d'eau m déstributeur li jay f la biblitèque esi",Daridja
Il fait chaud.,French
"yezer3ou el batata, tomatiche, el besbes ... koulech",Daridja
Les châteaux médiévaux français sont pleins de mystère.,French
C'est incroyable.,French
Étapes sont clairement distinguées.,French
na9der n3ayetlek ?,Daridja
Stool pigeon,English
"Fie, foh, fum, I smell the blood of an Englishman",English
khoudou 7derkom khawti,Daridja
testahli wach raho jayek,Daridja
Les éclats de rire des enfants sont un trésor précieux.,French
"C'était une émission sur la station France Inter, une station de radio nationale. ",French
"La vie de tous les jours, ",French
Da Wiiin FaT 3lYa Wa7eD YejRi Wa PaPah mOura BeL BaLa,Daridja
Bone up on,English
"Un coiffeur au masculin, et une coiffeuse en féminin.",French
Have you ever been to New York City?,English
à ne pas accepter des sacs plastiques à usage unique. ,French
Apple of my eye - The best laid schemes of mice and men.,English
An offer he can't refuse,English
Wlh mnzid ndir régime f ramdan,Daridja
Les étudiants apprécient l'éducation de qualité.,French
"W li mazalo bara rh jey nharhom tan inshallah,",Daridja
The camera cannot lie,English
Lounou 9ahwi,Daridja
Flash in the pan,English
Bonne journée !,French
There's no such thing as a free lunch (Tanstaafl),English
If I had my druthers,English
Indian summer,English
Il avait une barbe très longue.,French
The Yellow Peril,English
dakhlet la bourse wella mzl,Daridja
I can't believe I scored 95% on the exam!,English
"O Romeo, Romeo! wherefore art thou Romeo?",English
mazal 21 jrs 3la l exam zad chapitre hakka w mazlakoum ta9raaawww,Daridja
Talk the talk baby,English
W li rahom ygolo belli ra7 neba3ed,Daridja
Pourquoi es-tu si énervé ?,French
Pearls before swine,English
Gilt off the gingerbread,English
Le petit chaperon rouge.,French
White as snow,English
Up in arms,English
J'ai entendu un article très intéressant sur l'obsolescence programmée. ,French
Grist to the mill,English
3awent la bgha chwiya Bladi 9bal mankhrej,Daridja
C'est génial !,French
Chinese whispers,English
"Are you free this afternoon, my lady ?",English
Bells and whistles,English
I'll have your guts for garters,English
Les châteaux de la Loire sont magnifiques.,French
Fall off the back of a lorry,English
"Too much of a good thing turns it into a bad thing, ain't that right ?",English
Like it or lump it,English
il faut aussi préparer à manger.,French
"En arrivant à la ferme, ils rencontrent Louise l'oie.",French
Life in the 1500s - folk etymologies,English
Go to the dogs,English
Fools' gold,English
Sed9ouni rah Tchoufou bezaf la vieeee,Daridja
Bon appétit !,French
Where did you two meet ?,English
Pourquoi y a-t-il 2 tours ?,French
Ça va bien.,French
"C'est une journée pluvieuse, parfaite pour la lecture.",French
koul 3am w ntouma bkhir,Daridja
Hard lines,English
Nous devrions essayer ce restaurant français.,French
Lose your marbles,English
La cuisine française est délicieuse.,French
Wild goose chase,English
Ya rabi maychoufounache,Daridja
Il est agréable de flâner dans les marchés français.,French
"People say that he's gone crazy ... and some say that he turned into a wolf !The sun set behind the mountains, casting a warm glow on the horizon.",English
salam aleykoum ila kyn someone y9der y3awen,Daridja
Things that go bump in the night,English
sq nakdar nakol thon tomate ma rani nakol walo ghir thon,Daridja
Marahche ga3 jayeb khbar,Daridja
Don't have a clue,English
A drop in the ocean,English
"Bon kima 3labalkom kaml, corona rahi binatna",Daridja
za3ma ch3al tjini rani bghya had l 7achw w hadak design,Daridja
"En 2015 par exemple,",French
Selmili ala darkom kamel ,Daridja
Twenty four seven,English
Un système d'exploitation peut être vu comme un programme.,French
No names: no pack-drill.,English
Carbon footprint,English
Nul points.,English
Goulilha tkhef ro7ha,Daridja
Let your hair down,English
Khoya kira7 bghit n7ami 3lik Walakin,Daridja
Salem khoya Kayen wahad nssa lmoto,Daridja
Proverbs - A list of,English
It's high time,English
You can lead a horse to water but you can't make it drink.,English
kess tay w kess café noir ,Daridja
Rahi f la bib,Daridja
Les châteaux médiévaux français sont pleins de mystère.,French
"That's all she wrote, unfortunately.",English
Elle lit des poèmes pour Roger le pigeon.,French
Bale out/bail out,English
BALAK RABI YSEGEMHA 3LINA,Daridja
Ajouter à ce schéma les contraintes d'intégrité nécessaires.,French
w ana hadak genre ta3 bnyadam manahamlouch,Daridja
darlek haka 9rib wesslek l sbitar,Daridja
Balak Berk ichouf la publication izidlek ghadwa lyad lokhra lol,Daridja
Adam's ale,English
C'est passionnant.,French
Dawertilna gloubna brk  o9sembilah,Daridja
He who laughs last laughs longest,English
modifications continues (maintenance).,French
Une adresse est codée sur 32 bits ( 4 octets ).,French
Know which way the wind blows,English
"Par une matinée tout à fait normale, ",French
The Devil Incarnate,English
chfite kifech darlna el khatra li fatet ? ,Daridja
wchmen resources li tans7oni bihoum,Daridja
Zino nhar lyoum saha eidkom,Daridja
Mighty oaks from little acorns grow,English
Elvis has left the building.,English
Fancy pants!,English
Hbibna hdk raho hab ydirlk hkda wa9il mais f l'esi,Daridja
Une conte de fées.,French
Ya khawti nmet khessert rejim ta3i ftant direct,Daridja
Les verbes auxilières sont: être et avoir.,French
Compétitions internationales multisports (type jeux olympiques).,French
telechargiw la photo li tosslkom fal mail wkol sba7 diro t check in biha ,Daridja
My husband and I,English
Rani haba dok ana nji nederbek nederbek nederbek,Daridja
Course of true love never did run smooth - The,English
Est-ce que tu aimes les films d'animation français ?,French
Ana bdit regime aandi prsq 15jrs lpoid taai nafsou,Daridja
Est-ce que vous pensez que cela vous rend plus productif ?,French
Quand le ministre de la culture de l'époque l'a mise en place le 21 juin de cette année-là. ,French
Doff your hat,English
chhal men marra nechri nafs el haja,Daridja
Push the boat out,English
No room to swing a cat,English
Même notre pause déjeuner est souvent la même. ,French
Les cascades dans les montagnes sont un spectacle grandiose.,French
bah tchof prof y9ari man niytou online w ydir effort,Daridja
Win hands down,English
La tour Eiffel est magnifique la nuit.,French
ghir l bara7 khawetna f alger darbouhom,Daridja
Il est agréable de se promener dans les jardins français.,French
Vanish into thin air,English
The astronaut marveled at the vastness of space from the spacecraft's window.,English
"Il n'y a rien à gagner, rien à perdre. ",French
Why does bread always fall butter side down?,English
Bonjour à tous !,French
dans une petite ville normale.,French
n3awedou ntfakrou bli covid marahach khawti,Daridja
hadak lprof dima yadareb m3a martou f wa9t les exams,Daridja
"alhamdoulilah Rabi 9aderni,b nass lkhir",Daridja
Play by ear,English
Où est-ce que tu as trouvé ce livre intéressant ?,French
C'est la première fois que je visite ce pays.,French
Wlh ana tani farhana biik,Daridja
"W kol wa7d yji nharo inshallah, car Rabi Kayen. ",Daridja
marhba bikoum,Daridja
Have you tried to solve your homework by yourself ?,English
"Early to bed and early to rise makes a man healthy, wealthy and wise",English
"The sculptor chiseled away at the marble, revealing a masterpiece within.",English
Call of the wild - The,English
L'émission s'appelle 'CO2 mon amour'. ,French
kima jat lihom 9ader ji lina normal,Daridja
Slt l'équipe ra7 nbadlo kifach ndiro check in,Daridja
Les cafés parisiens sont pleins de caractère.,French
kayan haja hayratni ,Daridja
Age before beauty,English
galouli lcous louwel ydemarri 3a 7 w noss ...,Daridja
"Carine la cane, Louise l'oie et Roger le pigeon courent ensemble sur la route vers la ville.",French
"C'est une journée froide, idéale pour une tasse de chocolat chaud.",French
w les conditions etccccc,Daridja
In a cleft stick,English
"w darna w shabi, kdert nched trig sah",Daridja
The balance of trade,English
"C'est une belle journée ensoleillée, parfaite pour une sortie.",French
Lamb to the slaughter,English
maniche ray7a,Daridja
Carine la cane courent ensemble sur la route vers la ferme.,French
Les éclats de rire des enfants résonnent dans la cour de récréation.,French
"Neither fish nor flesh, nor good red herring.",English
Pourquoi ne pas essayer un vin français ?,French
Les étoiles brillent dans le ciel nocturne.,French
Pig's ear,English
C'est une journée ensoleillée et chaude.,French
Smoke and mirrors,English
Leopard cannot change its spots - A,English
"Après le travail, il est temps de faire des achats, ",French
nmout alik yemma rabbi ykhallik,Daridja
Play fast and loose,English
w7deh bghit brk  3ref wch rak 7at fih hada makan,Daridja
Ministering angel shall my sister be - A,English
C'est très simple et compliqué à la fois ! ,French
The scientist conducted experiments to unravel the mysteries of the universe.,English
All things come to he who waits,English
L'oiseau aimait le beau sourire de la baleine.,French
J'aimerais visiter la Provence un jour.,French
3lech haka 3lech welitou socialet bezaf,Daridja
Salut l3ibad...,Daridja
Man does not live by bread alone,English
Pourquoi ne pas essayer de faire du ski dans les Alpes ?,French
Hands down,English
Pourquoi ne pas essayer de déguster du vin dans une cave française ?,French
Il est important de comprendre la culture française.,French
kima sahbetha,Daridja
The nth degree,English
"Si vous êtes comme moi, ",French
Christmas box - A song,English
"Friends, Romans, Countrymen, lend me your ears",English
asme3 rak tchouf fel match hadek,Daridja
Fifteen minutes of fame.,English
Ch7al nmedlek masrouf ,Daridja
Congratulations on your promotion at work!,English
Scott (Sir Walter - phrases coined by),English
Dog's breakfast,English
"(man9derch nwriha l sa7bi Wella l familti, bah mayt7yroch 3liya)",Daridja
Pourquoi ne pas essayer de préparer un dessert français ?,French
Wlh matstahl ghr kol khirr,Daridja
"Space, the final frontier.",English
Last straw - The,English
Eat drink and be merry,English
malguitche haja t3awedha,Daridja
lchghol mli7 ytwl.,Daridja
Salut tout le monde ! dit Louise. ,French
"Les petits poissons dans l'eau nagent, nagent, nagent, nagent.",French
le prototype non-jetable,French
"wellah rir Html makansh elabali wsh maentha ,",Daridja
Hoity-toity,English
et les déposer à l'école. ,French
Win one for the Gipper,English
Dock your pay,English
What's in a name? That which we call a rose by any other name would smell as sweet,English
Body - phrases related to the human body.,English
"Je fais une glace de Noël, elle est rouge, verte et blanche.",French
As queer as a nine bob note,English
Habit n9olk bli le service minimum  ta3 cous  bouraoui  ,Daridja
Drink like a fish,English
Où vas-tu ? Pourquoi as-tu si peur ?,French
Les éclats de rire des enfants résonnent dans la cour de récréation.,French
"Sder bel L7am Mafroum,",Daridja
ou en regardant notre émission préférée à la télévision.,French
wech darou f resto ??,Daridja
Comment ça va aujourd'hui ?,French
Ki prif maydirch khadmto ndirha ana  ???????,Daridja
One for the road,English
Ya khti sahla mahla ajbdi bidoun,Daridja
"wla hab tlh9 l hadja rahi f 9lbk ,  ",Daridja
Elles sont exprimées à l'aide de douze chiffres hexadécimaux.,French
The love that dare not speak its name.,English
Wa9iL KhrejT rSulTa Ta3 BaC,Daridja
Pourquoi ne pas essayer de faire du vélo le long des canaux français ?,French
C'est étrange.,French
Cook the books,English
"Il y a des cheveux chatins, noirs, roux et marrons.",French
Buckle down,English
On the wagon,English
The shot heard 'round the world,English
Pourquoi ne pas essayer de faire du vélo en France ?,French
tsgmt lablad wa9il ?,Daridja
localiser les erreurs (grâce à la forte cohésion).,French
The architect designed a modern skyscraper that stood out in the cityscape.,English
Surfing the Net/surfing the Internet/surfing the Web,English
e que j'aime particulièrement à propos de la tour Eiffel,French
Let there be light,English
Word association football,English
Get a word in edgeways,English
A diamond is forever,English
Alive and kicking,English
Comment trouve-tu la cuisine française ?,French
fi messreghin stp Ida jabohelkom teflechoh gololi,Daridja
"To be or not to be, that is the question",English
Chop-chop,English
I'm 23 years old.,English
Give a man a fish and you will feed him for a day,English
Fine as frog's hair,English
Baby boomer,English
C'est une journée ensoleillée.,French
nahat el hidjab,Daridja
Fall from grace,English
According to Hoyle,English
C'est merveilleux.,French
Il est important de pratiquer une langue régulièrement.,French
It's all grist to the mill,English
CBon L7a9 lwa9t win n9olelkom Salam,Daridja
Oh non ! Ça doit être vrai !,French
cbon banetli hadak howa l7a9 lwa9t bach nglkom by by ensaw esmi,Daridja
Les introvertis préfèrent rentrer chez eux aussi vite que possible.,French
Les éclats de rire des enfants réchauffent le c?ur.,French
All that glitters is not gold / All that glisters is not gold.,English
Les éclats de rire résonnent dans la salle.,French
C'est une bonne idée.,French
Meat and drink,English
nsa9sikom li yo9a3do f les boxs ychofo les series  wela ya9raw ?,Daridja
Je mets la nappe de Noël sur la table. ,French
Butter wouldn't melt in his mouth. But it can melt in his hands !,English
Il pleut.,French
The recipe calls for three cups of flour.,English
Power corrupts; absolute power corrupts absolutely.,English
Pleased as Punch,English
A bunch of fives,English
The road less travelled,English
The fat of the land,English
Bed of roses,English
ou simplement se détendre en lisant un livre ,French
"C'est une journée ensoleillée, parfaite pour une balade à vélo.",French
C'était une expérience inoubliable.,French
Fair and square,English
Put your best foot forward,English
Ah wah nti machi normal fi rassek,Daridja
Folk Etymology - The Nonsense Nine,English
A plague on both your houses,English
L'écrivain a utilisé des mots français dans son roman.,French
Blot on the landscape,English
wlidou tayer w bentou 3a9la,Daridja
kayan 1000 haja dirha,Daridja
mahich khadma ta3 rjal,Daridja
Kettle of fish.,English
Better to have loved and lost than never to have loved at all,English
nahit kolch 9olt maalichh lsnsl la taille f la fin man9ost hêtta kilos,Daridja
Jump the shark,English
"Le réchauffement de la planète, etc.",French
"Hello, my name's Harry.",English
tazwak hadak akol,Daridja
Ps : wesh kont tdir f dhelma hadik  ?,Daridja
mahabetche twelli ,Daridja
t9al3oulna fi 9albna m3akom pfffff,Daridja
can you tsawrili wech dertou f td bdd ??,Daridja
Quelle heure est-il madame titile ?,French
History is bunk,English
Et vous ?,French
The marathon runners persevered through the challenging course with determination.,English
Il est important de bien dormir la nuit.,French
Many a true word is spoken in jest,English
,French
Pour aller au travail on peut marcher ou alors conduire ,French
Pourquoi ne pas apprendre le français ?,French
twahachtak bezaf  man sabni m3ak même felkobr,Daridja
"Il s'assoit sous un arbre, sort son ordinateur portable et recommence à écrire.",French
Les larmes de ses yeux n'ont jamais arrêtés de couler.,French
Le ciel est en train de tomber ! ,French
chrite khatem jdid,Daridja
Nice as ninepence,English
Combien ça coûte ?,French
LE CIEEEEEEL EST EN TRAIN DE TOOOOOOMBER ! ,French
"C'est une journée pluvieuse, idéale pour rester à l'intérieur.",French
Où as-tu acheté ce magnifique chapeau ?,French
3andou f rass,Daridja
Hadak chami t3 dely brahim li kaml 9alo b'in,Daridja
Fruits of your loins,English
Il a si peur qu'il laisse tomber son toast dans son café. Plouf !,French
Rabi yakhd m'en Di leblad l7a9,Daridja
Open season,English
Où allez-vous ? Pourquoi avez-vous si peur ?,French
Back to square one,English
"Wlh derba fiya derba fihh ,",Daridja
"En s'inscrivant, le volontaire accepte de relever le défi. ",French
Petit Poulet mange son petit-déjeuner dans la cuisine. ,French
Et le second tour aura lieu le dimanche 7 Mai. ,French
Jim and Pam had a child : they named him Peter.,English
"Some men are born mediocre, some men achieve mediocrity, and some men, have mediocrity thrust upon them.",English
Une spécification d'interface,French
Break the ice and get into in.,English
Wellah ma kount naerf wesh ma3netha,Daridja
Over the top,English
La grotte est vide.,French
qu'ils seront utilisés pour l'indexation.,French
"Where do you live, sir ?",English
Freezing temperatures,English
Graveyard shift,English
L'attribut machine de TD prend la valeur.,French
Take umbrage,English
NTI kifech hallitiha,Daridja
ktbet Aliya Ani nokhrej parceque tadlamt bzaf fi had lard,Daridja
What's the capital of France?,English
A foot in the door,English
How much did you score ?,English
Mad as a hatter,English
kayan jma3a haba tafham,Daridja
"The old man sat on the porch, reminiscing about the good old days.",English
Not for all the tea in China,English
Inchallah towasslou qbel lil,Daridja
lazem tseeyi tcontacti leabed,Daridja
nti hbati tchri l ma w howa mryh,Daridja
"Petit Poulet vit dans une petite maison de poulet normale, ",French
lyoum wehdha khawnolha telephonha,Daridja
Donc n3agb par expl wahd ta 8 wrah wahd 4 wrah wahd 8 whia rayha,Daridja
wach n9olek hado lazem Ndaho bihom machi b lkbach wlh,Daridja
Nti mrida tkablou kolchi wtkhaltou n'importe qui,Daridja
W WAHED JAYEBHALI BEL WATANIYA 3LA JAL YERJA3 YE9RA,Daridja
Start from scratch,English
Shall I compare thee to a summer's day?,English
Les éclairs illuminent le ciel.,French
A stone's throw,English
Turn a blind eye,English
Les étoiles scintillent dans le ciel étoilé.,French
ano des mafia kima hadok 7akmohom. ,Daridja
Where there's muck there's brass,English
On a atteint 8 milliard dans la planète.,French
ila waslah msg yji 9ahwat lou7 yas9si 3liha,Daridja
Trick or treat,English
J'adore la nature.,French
The opera ain't over till the fat lady sings !,English
Pourquoi ne pas essayer de faire du vélo le long de la côte française ?,French
"(An) eye for an eye, a tooth for a tooth",English
"La vie est belle, n'est-ce pas ?",French
Go and boil your head,English
Beelzebub has a devil for a sideboard.,English
(Ne'er) cast a clout till May be out,English
For all intents and purposes,English
"Encore une fois, cela dépend si on a des enfants ou non. ",French
"Families gathered around the fireplace, sharing stories on a cold winter night.",English
Dollars to donuts,English
Tongue in cheek.,English
"Cela peut être partager un repas en famille, ",French
Quelle est ta région française préférée ?,French
The usual suspects,English
Je ne peux pas respirer !,French
"Eh oui, c'est toujours un dimanche !",French
salam kech site ntelechargiw mennou les series,Daridja
From sea to shining sea,English
Ya sidi rak faragh chghol,Daridja
Elle est fière de ses petits garçons.,French
"saha aidkoum ,",Daridja
"Toutes les activités qu'on fait pour soi, ",French
Game of two halves,English
Three strikes and you are out,English
"Une fois arrivés au 2ème, quel bonheur!",French
"What's up, tech enthusiasts? ",English
Retours-arrière qui peuvent être coûteux (effect tunnel).,French
Fashion victim,English
By and large,English
Every cloud has a silver lining,English
The baker skillfully crafted a tiered cake adorned with intricate decorations.,English
La première personne qu'il rencontre dans la rue est Pauline la poule. ,French
Bag and baggage,English
A rolling stone gathers no moss,English
zam3a cartier ta3 li ykhdmou f l education,Daridja
Je suis perdu.,French
Come up trumps,English
Il est agréable de prendre un café en terrasse.,French
Close your eyes and think of England.,English
A legend in one's own lifetime,English
"ou utiliser les transports en commun, comme le métro, le bus, le train. ",French
ha win ray7iinn winnnnn biha hakka,Daridja
Suivez-moi !,French
hatetelna photo kimk wra lghda ta l3id,Daridja
It's not rocket science,English
Gone for a burton,English
Beauty is only skin deep,English
Excuse my French,English
"C'est une journée ensoleillée, parfaite pour une sortie en plein air.",French
What's the price of the latest iPhone model?,English
Plates of meat,English
Je veux aller à la salle de bain.,French
Children giggled and played in the vibrant playground on a sunny afternoon.,English
LE CIEL EST EN TRAIN DE TOMBER ! ,French
Pie - as easy as,English
Now let's check out Boston Dynamics' Spot ,English
A woman's place is in the home,English
Les étoiles scintillent dans le ciel étoilé.,French
Where did you find such a beautiful necklace?,English
"Oh no! I forgot to bring my umbrella, and it's raining.",English
"Alas, poor Yorick! I knew him, Horatio.",English
The - unkindest cut of all,English
In the red flag.,English
(Take with a) pinch of salt,English
Les éclairs illuminent le ciel pendant l'orage d'été.,French
Stranger danger,English
saha remdankom,Daridja
A nest of vipers,English
fiha drodj twal ,Daridja
"Families gathered for a festive dinner, sharing laughter and joy.",English
The apple of my eye,English
ha n9olelkoum efsa .. ,Daridja
w kayn li wa9il rah radi b les résultats ta3 l hirak,Daridja
salam benti wech raki labess ?,Daridja
"The astronomer gazed through the telescope, exploring the mysteries of distant galaxies.",English
Ne'er do well,English
Richard the Third,English
Les étoiles filantes traversent le ciel nocturne.,French
"La vie de tous les jours, c'est souvent répétitif, ",French
Haven't got a clue,English
Card-sharp,English
